{
  "contractVersion": "1.2.0",
  "hostContract": "1.2.0",
  "feature": "review-feature",
  "runId": "run-01",
  "revision": 12,
  "phase": "review",
  "host": "codex",
  "assignment": {
    "phase": "review",
    "role": "judge",
    "model": "gpt-5-review",
    "effort": "medium"
  },
  "assignmentDigest": "aaaaaaaaaaaaaaaaaaaaaaaaaaaaaaaaaaaaaaaaaaaaaaaaaaaaaaaaaaaaaaaa",
  "objectiveDigest": "bbbbbbbbbbbbbbbbbbbbbbbbbbbbbbbbbbbbbbbbbbbbbbbbbbbbbbbbbbbbbbbb",
  "status": "active",
  "gateOutcome": "pass",
  "blockers": [],
  "openGaps": 0,
  "nextAction": "Complete the review phase and run kratos continue.",
  "memory": {
    "ref": ".brain/03-memory/gotchas.md",
    "sha256": "cccccccccccccccccccccccccccccccccccccccccccccccccccccccccccccccc",
    "lessonIds": []
  }
}
